{
  "behavior": "negotiate",
  "target": "price",
  "constraints": {
    "max_turns": 3,
    "max_budget": 30000,
    "max_words": 25,
    "max_duration_s": 8.0,
    "forbidden_intents": ["financing", "trade_in", "vehicle_change"],
    "must_not": ["invent_facts", "end_call"]
  },
  "candidate": {
    "act": "negotiate",
    "target": "price",
    "slots": {"max_budget": 30000},
    "utterance": "Would you be able to come down to $30,000?",
    "identity": {
      "behavior_id": "b2",
      "turn_id": 1,
      "generation_id": 1,
      "context_version": 0
    }
  }
}
